{
  "source": "ISTQB Glossary",
  "sourceUrl": "https://glossary.istqb.org/",
  "license": "CC BY 4.0",
  "licenseUrl": "https://creativecommons.org/licenses/by/4.0/",
  "usedIn": {
    "syllabus": "Foundation",
    "version": "v4.0"
  },
  "fetchedAt": "2026-10-05",
  "terms": [
    {
      "slug": "acceptance-criteria",
      "en": "acceptance criteria",
      "tr": "kabul kriterleri",
      "chunk": "terms-a"
    },
    {
      "slug": "acceptance-test-driven-development",
      "en": "acceptance test-driven development",
      "tr": "kabul testi güdümlü yazılım geliştirme",
      "chunk": "terms-a"
    },
    {
      "slug": "acceptance-testing",
      "en": "acceptance testing",
      "tr": "kabul testi",
      "chunk": "terms-a"
    },
    {
      "slug": "actual-result",
      "en": "actual result",
      "chunk": "terms-a"
    },
    {
      "slug": "agile-software-development",
      "en": "Agile software development",
      "chunk": "terms-a"
    },
    {
      "slug": "alpha-testing",
      "en": "alpha testing",
      "chunk": "terms-a"
    },
    {
      "slug": "anomaly",
      "en": "anomaly",
      "tr": "anomali",
      "chunk": "terms-a"
    },
    {
      "slug": "api-testing",
      "en": "API testing",
      "chunk": "terms-a"
    },
    {
      "slug": "audit",
      "en": "audit",
      "chunk": "terms-a"
    },
    {
      "slug": "availability",
      "en": "availability",
      "chunk": "terms-a"
    },
    {
      "slug": "behavior-driven-development",
      "en": "behavior-driven development",
      "chunk": "terms-b"
    },
    {
      "slug": "beta-testing",
      "en": "beta testing",
      "chunk": "terms-b"
    },
    {
      "slug": "black-box-test-technique",
      "en": "black-box test technique",
      "tr": "kara kutu test tekniği",
      "chunk": "terms-b"
    },
    {
      "slug": "boundary-value",
      "en": "boundary value",
      "chunk": "terms-b"
    },
    {
      "slug": "branch",
      "en": "branch",
      "chunk": "terms-b"
    },
    {
      "slug": "branch-coverage",
      "en": "branch coverage",
      "tr": "dal kapsamı",
      "chunk": "terms-b"
    },
    {
      "slug": "branch-testing",
      "en": "branch testing",
      "chunk": "terms-b"
    },
    {
      "slug": "cause-effect-diagram",
      "en": "cause-effect diagram",
      "chunk": "terms-c"
    },
    {
      "slug": "checklist-based-review",
      "en": "checklist-based reviewing",
      "chunk": "terms-c"
    },
    {
      "slug": "checklist-based-testing",
      "en": "checklist-based testing",
      "tr": "kontrol listesine dayalı test etme",
      "chunk": "terms-c"
    },
    {
      "slug": "coding-standard",
      "en": "coding standard",
      "chunk": "terms-c"
    },
    {
      "slug": "collaboration-based-test-approach",
      "en": "collaboration-based test approach",
      "tr": "iş birliğine dayalı test yaklaşımı",
      "chunk": "terms-c"
    },
    {
      "slug": "compatibility",
      "en": "compatibility",
      "chunk": "terms-c"
    },
    {
      "slug": "compliance",
      "en": "compliance",
      "chunk": "terms-c"
    },
    {
      "slug": "component",
      "en": "component",
      "chunk": "terms-c"
    },
    {
      "slug": "component-integration-testing",
      "en": "component integration testing",
      "tr": "bileşen entegrasyon testi",
      "chunk": "terms-c"
    },
    {
      "slug": "component-testing",
      "en": "component testing",
      "tr": "bileşen testi",
      "chunk": "terms-c"
    },
    {
      "slug": "confirmation-testing",
      "en": "confirmation testing",
      "tr": "onaylama testi",
      "chunk": "terms-c"
    },
    {
      "slug": "continuous-delivery",
      "en": "continuous delivery",
      "chunk": "terms-c"
    },
    {
      "slug": "continuous-deployment",
      "en": "continuous deployment",
      "chunk": "terms-c"
    },
    {
      "slug": "continuous-integration",
      "en": "continuous integration",
      "chunk": "terms-c"
    },
    {
      "slug": "continuous-testing",
      "en": "continuous testing",
      "chunk": "terms-c"
    },
    {
      "slug": "control-flow",
      "en": "control flow",
      "chunk": "terms-c"
    },
    {
      "slug": "cost-of-quality",
      "en": "cost of quality",
      "chunk": "terms-c"
    },
    {
      "slug": "coverage",
      "en": "coverage",
      "tr": "kapsam",
      "chunk": "terms-c"
    },
    {
      "slug": "coverage-criteria",
      "en": "coverage criteria",
      "chunk": "terms-c"
    },
    {
      "slug": "coverage-item",
      "en": "coverage item",
      "tr": "kapsam öğesi",
      "chunk": "terms-c"
    },
    {
      "slug": "dashboard",
      "en": "dashboard",
      "chunk": "terms-d"
    },
    {
      "slug": "debugging",
      "en": "debugging",
      "tr": "hata ayıklama",
      "chunk": "terms-d"
    },
    {
      "slug": "decision-table-testing",
      "en": "decision table testing",
      "tr": "karar tablosu testi",
      "chunk": "terms-d"
    },
    {
      "slug": "defect",
      "en": "defect",
      "tr": "hata",
      "chunk": "terms-d"
    },
    {
      "slug": "defect-density",
      "en": "defect density",
      "chunk": "terms-d"
    },
    {
      "slug": "defect-detection-percentage",
      "en": "defect detection percentage",
      "chunk": "terms-d"
    },
    {
      "slug": "defect-management",
      "en": "defect management",
      "tr": "hata yönetimi",
      "chunk": "terms-d"
    },
    {
      "slug": "defect-report",
      "en": "defect report",
      "tr": "hata raporu",
      "chunk": "terms-d"
    },
    {
      "slug": "driver",
      "en": "driver",
      "chunk": "terms-d"
    },
    {
      "slug": "dynamic-testing",
      "en": "dynamic testing",
      "tr": "dinamik test",
      "chunk": "terms-d"
    },
    {
      "slug": "each-choice-coverage",
      "en": "each choice coverage",
      "chunk": "terms-e"
    },
    {
      "slug": "effectiveness",
      "en": "effectiveness",
      "chunk": "terms-e"
    },
    {
      "slug": "efficiency",
      "en": "efficiency",
      "chunk": "terms-e"
    },
    {
      "slug": "entry-criteria",
      "en": "entry criteria",
      "tr": "giriş kriterleri",
      "chunk": "terms-e"
    },
    {
      "slug": "equivalence-partition",
      "en": "equivalence partition",
      "chunk": "terms-e"
    },
    {
      "slug": "equivalence-partitioning",
      "en": "equivalence partitioning",
      "tr": "denklik paylarına ayırma",
      "chunk": "terms-e"
    },
    {
      "slug": "error",
      "en": "error",
      "tr": "insan hatası",
      "chunk": "terms-e"
    },
    {
      "slug": "error-guessing",
      "en": "error guessing",
      "tr": "hata tahminleme",
      "chunk": "terms-e"
    },
    {
      "slug": "exhaustive-testing",
      "en": "exhaustive testing",
      "chunk": "terms-e"
    },
    {
      "slug": "exit-criteria",
      "en": "exit criteria",
      "tr": "çıkış kriterleri",
      "chunk": "terms-e"
    },
    {
      "slug": "expected-result",
      "en": "expected result",
      "chunk": "terms-e"
    },
    {
      "slug": "experience-based-test-technique",
      "en": "experience-based test technique",
      "tr": "tecrübeye dayalı test tekniği",
      "chunk": "terms-e"
    },
    {
      "slug": "exploratory-testing",
      "en": "exploratory testing",
      "tr": "keşif testi",
      "chunk": "terms-e"
    },
    {
      "slug": "failed",
      "en": "failed",
      "chunk": "terms-f"
    },
    {
      "slug": "failure",
      "en": "failure",
      "tr": "arıza",
      "chunk": "terms-f"
    },
    {
      "slug": "fault-attack",
      "en": "fault attack",
      "chunk": "terms-f"
    },
    {
      "slug": "feature-driven-development",
      "en": "feature-driven development",
      "chunk": "terms-f"
    },
    {
      "slug": "finding",
      "en": "finding",
      "chunk": "terms-f"
    },
    {
      "slug": "formal-review",
      "en": "formal review",
      "tr": "resmi gözden geçirme",
      "chunk": "terms-f"
    },
    {
      "slug": "functional-appropriateness",
      "en": "functional appropriateness",
      "chunk": "terms-f"
    },
    {
      "slug": "functional-completeness",
      "en": "functional completeness",
      "chunk": "terms-f"
    },
    {
      "slug": "functional-correctness",
      "en": "functional correctness",
      "chunk": "terms-f"
    },
    {
      "slug": "heuristic",
      "en": "heuristic",
      "chunk": "terms-h"
    },
    {
      "slug": "impact-analysis",
      "en": "impact analysis",
      "chunk": "terms-i"
    },
    {
      "slug": "incremental-development-model",
      "en": "incremental development model",
      "chunk": "terms-i"
    },
    {
      "slug": "independence-of-testing",
      "en": "independence of testing",
      "chunk": "terms-i"
    },
    {
      "slug": "informal-review",
      "en": "informal review",
      "tr": "gayri resmi gözden geçirme",
      "chunk": "terms-i"
    },
    {
      "slug": "inspection",
      "en": "inspection",
      "tr": "teftiş",
      "chunk": "terms-i"
    },
    {
      "slug": "integration-testing",
      "en": "integration testing",
      "tr": "entegrasyon testi",
      "chunk": "terms-i"
    },
    {
      "slug": "integrity",
      "en": "integrity",
      "chunk": "terms-i"
    },
    {
      "slug": "iterative-development-model",
      "en": "iterative development model",
      "chunk": "terms-i"
    },
    {
      "slug": "maintainability",
      "en": "maintainability",
      "chunk": "terms-m"
    },
    {
      "slug": "maintenance",
      "en": "maintenance",
      "chunk": "terms-m"
    },
    {
      "slug": "maintenance-testing",
      "en": "maintenance testing",
      "tr": "bakım testi",
      "chunk": "terms-m"
    },
    {
      "slug": "maturity",
      "en": "maturity",
      "chunk": "terms-m"
    },
    {
      "slug": "mean-time-to-failure",
      "en": "mean time to failure",
      "chunk": "terms-m"
    },